{
  "$schema": "../profile.schema.json",
  "meta": {
    "cvVersion": "2026.09"
  },
  "header": {
    "name": "Sohayb Hassan",
    "title": "Full-Stack Engineer · Java / Spring Boot · React · Banking & Financial Services",
    "location": "Turin, Italy",
    "city": "Turin",
    "countryCode": "IT",
    "nationality": "Egyptian",
    "permit": "Italian work residence permit (renewable)",
    "email": "sohaybmohammed@icloud.com",
    "linkedin": "https://www.linkedin.com/in/sohayb/",
    "github": "https://github.com/soyhub"
  },
  "summary": "Full-stack engineer with six years at Capgemini building backend and web systems for banks, insurers and corporate clients. Currently delivers features end to end on a retail bank's mobile platform: Java 17 / Spring Boot 3 microservices, an OpenAPI-first BFF layer on JDK 21 and the React Native app. At home with the unglamorous side of banking integration (legacy hosts, BPM processes, multi-environment release pipelines) and with the tooling that keeps a large multi-repository programme moving. Started out migrating COBOL to Spring Boot; now spends personal time on LLM-assisted modernisation tooling where the output is verified, not trusted.",
  "availability": {
    "state": "employed",
    "label": "hired · accepting offers"
  },
  "headline": [
    {
      "value": "6 yrs",
      "label": "Capgemini · banking & financial services"
    },
    {
      "value": "3 layers",
      "label": "microservices · BFF · mobile app"
    },
    {
      "value": "COBOL → Java",
      "label": "legacy modernisation, hands-on"
    }
  ],
  "experience": [
    {
      "company": "Capgemini",
      "place": "Turin, Italy",
      "role": "Consultant – Full Stack",
      "dates": "08/2023 – present",
      "blocks": [
        {
          "title": "Mobile banking platform — major Italian retail banking group",
          "dates": "02/2025 – present",
          "bullets": [
            "Deliver features end to end across all three layers: Java 17 / Spring Boot 3 microservices, an OpenAPI-first BFF on JDK 21 and the React Native / Redux Toolkit app.",
            "Design and build new banking product flows and REST APIs, from the OpenAPI contract through the BFF and microservice to the app state, including hand-offs to the bank's BPM processes.",
            "Integrate legacy banking systems over SOAP and REST — payments, cards, limits and document processing — with the error handling that keeps the app usable when a host misbehaves.",
            "Caching, resilience and observability in production (Hazelcast, Resilience4j, Micrometer/Prometheus, Splunk, Dynatrace); Kubernetes deployments through Azure DevOps release pipelines across multiple environments.",
            "Built the team's internal tooling: environment and API-collection generators, git guard hooks, end-to-end test harnesses, an LLM-assisted agent workflow with a regression suite, and the engineering handbook.",
            "Mentor junior developers and run knowledge-transfer sessions on Spring Boot and React practice."
          ]
        },
        {
          "title": "Digital HR platform — corporate group",
          "dates": "08/2023 – 02/2025",
          "bullets": [
            "Built the employee-facing web platform in React + TypeScript on SharePoint Framework, from Figma prototypes to production; REST integration with the HR back end; Azure DevOps CI/CD set up together with the DevOps team."
          ]
        }
      ]
    },
    {
      "company": "Capgemini",
      "place": "Turin, Italy",
      "role": "Analyst Consultant – Full Stack",
      "dates": "01/2021 – 08/2023",
      "subtitle": "Media, insurance and oil & gas clients",
      "blocks": [
        {
          "bullets": [
            "Advertising segmentation tool for a German pay-TV broadcaster: React front end for audience targeting, Akka-based microservices and Elasticsearch for real-time segmentation; Mocha/Chai tests, releases through UAT to production.",
            "Oil & gas client: Spring Boot services on Hibernate/PostgreSQL feeding Angular.js dashboards; tuned the data pipeline behind them."
          ]
        }
      ]
    },
    {
      "company": "Capgemini",
      "place": "Turin, Italy",
      "role": "Intern – Full Stack",
      "dates": "10/2020 – 01/2021",
      "subtitle": "Insurance client",
      "blocks": [
        {
          "bullets": [
            "Migrated a legacy COBOL policy-listing system to Java Spring Boot services (Hibernate/JDBC on PostgreSQL) consumed by an Angular.js front end; kept the Maven/Git CI running for the team."
          ]
        }
      ]
    },
    {
      "company": "TogoMetrics",
      "place": "Turin, Italy",
      "role": "Intern – Full Stack",
      "dates": "06/2020 – 09/2020",
      "blocks": [
        {
          "bullets": [
            "React + TypeScript / Node.js MVP for an agri-tech client, built end to end in a team of four."
          ]
        }
      ]
    }
  ],
  "projects": [
    {
      "id": "legacy-modernisation",
      "title": "LLM-assisted legacy modernisation",
      "status": "in-progress",
      "summary": "COBOL to Spring Boot with differential-execution verification of the generated code: the referee that proves equivalence is built before the agent that writes the code. Personal project.",
      "stack": [
        "Python",
        "Java 17",
        "Spring Boot 3",
        "Claude API",
        "tool-calling agents",
        "evaluation harness"
      ]
    },
    {
      "id": "workflow-automation",
      "title": "Engineering-workflow automation",
      "status": "shipped",
      "summary": "For the banking programme above: LLM agents and skills wired to git hooks, an approval gate and a regression suite, so the assistant follows the team's branch and review rules instead of bypassing them.",
      "stack": ["LLM agents", "git hooks", "regression suite", "Azure DevOps"]
    }
  ],
  "skills": [
    {
      "id": "backend",
      "label": "Backend",
      "items": [
        "Java 17/21",
        "Spring Boot 3",
        "Spring Integration",
        "Hibernate/JPA",
        "MapStruct",
        "Apache CXF/JAXB (SOAP)",
        "OpenAPI Generator",
        "Kafka",
        "Hazelcast",
        "Resilience4j",
        "jBPM client",
        "Node.js",
        "Akka Streams"
      ]
    },
    {
      "id": "frontend",
      "label": "Frontend & mobile",
      "items": [
        "React",
        "TypeScript",
        "React Native",
        "Redux Toolkit",
        "SharePoint Framework (SPFx)",
        "Bootstrap",
        "Angular.js (legacy)"
      ]
    },
    {
      "id": "data",
      "label": "Data",
      "items": ["Oracle", "PostgreSQL", "SQL Server", "MongoDB", "Couchbase", "Elasticsearch"]
    },
    {
      "id": "platform",
      "label": "Platform",
      "items": [
        "Kubernetes",
        "Docker",
        "Jib",
        "Istio",
        "Azure DevOps pipelines",
        "GitLab CI",
        "GitHub Actions",
        "Jenkins",
        "WSO2 API Manager",
        "Splunk",
        "Dynatrace",
        "Prometheus/Micrometer"
      ]
    },
    {
      "id": "testing",
      "label": "Testing & practice",
      "items": [
        "JUnit 5",
        "Mockito",
        "WireMock",
        "JaCoCo",
        "Jest",
        "Mocha/Chai",
        "OpenAPI-first design",
        "Scrum",
        "code review",
        "Sonar"
      ]
    },
    {
      "id": "learning",
      "label": "Learning now",
      "items": ["Python", "LLM APIs and tool-calling agents", "evaluation harnesses"]
    }
  ],
  "education": [
    {
      "what": "BSc Computer Science (online)",
      "where": "University of the People, Pasadena, CA",
      "when": "in progress"
    },
    {
      "what": "Associate of Science, Computer Science",
      "where": "University of the People",
      "when": "2020 – 2023"
    },
    {
      "what": "Software Development Bootcamp",
      "where": "Powercoders, Turin",
      "when": "12/2019 – 03/2020"
    },
    {
      "what": "Computer Science coursework",
      "where": "Saratov State University, Russia"
    }
  ],
  "languages": [
    {
      "name": "Arabic",
      "level": "native"
    },
    {
      "name": "English",
      "level": "C1"
    },
    {
      "name": "Italian",
      "level": "C1"
    },
    {
      "name": "Russian",
      "level": "B1"
    }
  ]
}
