{
  "$schema": "../profile.schema.json",
  "meta": {
    "cvVersion": "2026.09"
  },
  "header": {
    "name": "Sohayb Hassan",
    "title": "Full-Stack-инженер · Java / Spring Boot · React · Банки и финансовые услуги",
    "location": "Турин, Италия",
    "city": "Turin",
    "countryCode": "IT",
    "nationality": "Египтянин",
    "permit": "Итальянский вид на жительство для работы (продлеваемый)",
    "email": "sohaybmohammed@icloud.com",
    "linkedin": "https://www.linkedin.com/in/sohayb/",
    "github": "https://github.com/soyhub"
  },
  "summary": "Full-stack-инженер с шестью годами в Capgemini, создающий backend- и веб-системы для банков, страховых компаний и корпоративных клиентов. Сейчас поставляет функциональность от начала до конца на мобильной платформе розничного банка: микросервисы Java 17 / Spring Boot 3, слой BFF по принципу OpenAPI-first на JDK 21 и приложение React Native. Уверенно чувствует себя в неброской стороне банковской интеграции (legacy-хосты, процессы BPM, пайплайны релизов в нескольких окружениях) и в инструментах, которые держат в движении большую программу с множеством репозиториев. Начинал с миграции COBOL на Spring Boot; сейчас в личное время занимается инструментами модернизации с помощью LLM, где результат проверяется, а не принимается на веру.",
  "availability": {
    "state": "employed",
    "label": "трудоустроен · открыт к предложениям"
  },
  "headline": [
    {
      "value": "6 лет",
      "label": "Capgemini · банки и финансовые услуги"
    },
    {
      "value": "3 слоя",
      "label": "микросервисы · BFF · мобильное приложение"
    },
    {
      "value": "COBOL → Java",
      "label": "модернизация legacy, своими руками"
    }
  ],
  "experience": [
    {
      "company": "Capgemini",
      "place": "Турин, Италия",
      "role": "Консультант – Full Stack",
      "dates": "08/2023 – present",
      "blocks": [
        {
          "title": "Платформа мобильного банкинга — крупная итальянская розничная банковская группа",
          "dates": "02/2025 – present",
          "bullets": [
            "Поставляет функциональность от начала до конца на всех трёх слоях: микросервисы Java 17 / Spring Boot 3, BFF по принципу OpenAPI-first на JDK 21 и приложение React Native / Redux Toolkit.",
            "Проектирует и строит новые потоки банковских продуктов и REST API — от контракта OpenAPI через BFF и микросервис до состояния приложения, включая передачу в BPM-процессы банка.",
            "Интегрирует legacy-системы банка по SOAP и REST — платежи, карты, лимиты и обработку документов — с обработкой ошибок, которая сохраняет приложение работоспособным, когда хост ведёт себя некорректно.",
            "Кэширование, отказоустойчивость и наблюдаемость в продакшене (Hazelcast, Resilience4j, Micrometer/Prometheus, Splunk, Dynatrace); развёртывания в Kubernetes через релизные пайплайны Azure DevOps в нескольких окружениях.",
            "Создал внутренний инструментарий команды: генераторы окружений и API-коллекций, защитные git-хуки, каркасы для сквозных тестов, агентный рабочий процесс на LLM с регрессионным набором тестов и инженерный справочник.",
            "Наставляет младших разработчиков и проводит сессии передачи знаний по практике Spring Boot и React."
          ]
        },
        {
          "title": "Цифровая HR-платформа — корпоративная группа",
          "dates": "08/2023 – 02/2025",
          "bullets": [
            "Создал веб-платформу для сотрудников на React + TypeScript поверх SharePoint Framework — от прототипов в Figma до продакшена; REST-интеграция с HR-бэкендом; CI/CD в Azure DevOps настроен вместе с командой DevOps."
          ]
        }
      ]
    },
    {
      "company": "Capgemini",
      "place": "Турин, Италия",
      "role": "Аналитик-консультант – Full Stack",
      "dates": "01/2021 – 08/2023",
      "subtitle": "Клиенты из медиа, страхования и нефтегазовой отрасли",
      "blocks": [
        {
          "bullets": [
            "Инструмент рекламной сегментации для немецкого платного телеканала: фронтенд на React для таргетинга аудитории, микросервисы на Akka и Elasticsearch для сегментации в реальном времени; тесты Mocha/Chai, релизы через UAT в продакшен.",
            "Нефтегазовый клиент: сервисы Spring Boot на Hibernate/PostgreSQL для дашбордов на Angular.js; оптимизация стоящего за ними пайплайна данных."
          ]
        }
      ]
    },
    {
      "company": "Capgemini",
      "place": "Турин, Италия",
      "role": "Стажёр – Full Stack",
      "dates": "10/2020 – 01/2021",
      "subtitle": "Страховой клиент",
      "blocks": [
        {
          "bullets": [
            "Перенёс legacy-систему на COBOL для списка полисов в сервисы Java Spring Boot (Hibernate/JDBC на PostgreSQL), используемые фронтендом на Angular.js; поддерживал работу CI на Maven/Git для команды."
          ]
        }
      ]
    },
    {
      "company": "TogoMetrics",
      "place": "Турин, Италия",
      "role": "Стажёр – Full Stack",
      "dates": "06/2020 – 09/2020",
      "blocks": [
        {
          "bullets": [
            "MVP на React + TypeScript / Node.js для агротех-клиента, построенный от начала до конца в команде из четырёх человек."
          ]
        }
      ]
    }
  ],
  "projects": [
    {
      "id": "legacy-modernisation",
      "title": "Модернизация legacy с помощью LLM",
      "status": "in-progress",
      "summary": "С COBOL на Spring Boot с проверкой сгенерированного кода дифференциальным выполнением: арбитр, доказывающий эквивалентность, строится раньше агента, который пишет код. Личный проект.",
      "stack": [
        "Python",
        "Java 17",
        "Spring Boot 3",
        "Claude API",
        "tool-calling agents",
        "evaluation harness"
      ]
    },
    {
      "id": "workflow-automation",
      "title": "Автоматизация инженерного рабочего процесса",
      "status": "shipped",
      "summary": "Для банковской программы выше: LLM-агенты и навыки, подключённые к git-хукам, шлюз согласования и регрессионный набор тестов, чтобы ассистент следовал правилам веток и ревью команды, а не обходил их.",
      "stack": ["LLM agents", "git hooks", "regression suite", "Azure DevOps"]
    }
  ],
  "skills": [
    {
      "id": "backend",
      "label": "Backend",
      "items": [
        "Java 17/21",
        "Spring Boot 3",
        "Spring Integration",
        "Hibernate/JPA",
        "MapStruct",
        "Apache CXF/JAXB (SOAP)",
        "OpenAPI Generator",
        "Kafka",
        "Hazelcast",
        "Resilience4j",
        "jBPM client",
        "Node.js",
        "Akka Streams"
      ]
    },
    {
      "id": "frontend",
      "label": "Frontend и мобильная разработка",
      "items": [
        "React",
        "TypeScript",
        "React Native",
        "Redux Toolkit",
        "SharePoint Framework (SPFx)",
        "Bootstrap",
        "Angular.js (legacy)"
      ]
    },
    {
      "id": "data",
      "label": "Данные",
      "items": ["Oracle", "PostgreSQL", "SQL Server", "MongoDB", "Couchbase", "Elasticsearch"]
    },
    {
      "id": "platform",
      "label": "Платформа",
      "items": [
        "Kubernetes",
        "Docker",
        "Jib",
        "Istio",
        "Azure DevOps pipelines",
        "GitLab CI",
        "GitHub Actions",
        "Jenkins",
        "WSO2 API Manager",
        "Splunk",
        "Dynatrace",
        "Prometheus/Micrometer"
      ]
    },
    {
      "id": "testing",
      "label": "Тестирование и практики",
      "items": [
        "JUnit 5",
        "Mockito",
        "WireMock",
        "JaCoCo",
        "Jest",
        "Mocha/Chai",
        "OpenAPI-first design",
        "Scrum",
        "code review",
        "Sonar"
      ]
    },
    {
      "id": "learning",
      "label": "Изучает сейчас",
      "items": ["Python", "LLM APIs and tool-calling agents", "evaluation harnesses"]
    }
  ],
  "education": [
    {
      "what": "Бакалавр компьютерных наук (онлайн)",
      "where": "University of the People, Пасадина, Калифорния",
      "when": "в процессе"
    },
    {
      "what": "Associate of Science, компьютерные науки",
      "where": "University of the People",
      "when": "2020 – 2023"
    },
    {
      "what": "Буткемп по разработке ПО",
      "where": "Powercoders, Турин",
      "when": "12/2019 – 03/2020"
    },
    {
      "what": "Курсы по компьютерным наукам",
      "where": "Саратовский государственный университет, Россия"
    }
  ],
  "languages": [
    {
      "name": "Арабский",
      "level": "родной"
    },
    {
      "name": "Английский",
      "level": "C1"
    },
    {
      "name": "Итальянский",
      "level": "C1"
    },
    {
      "name": "Русский",
      "level": "B1"
    }
  ]
}
